comment,label
4xl rung yếu xìu. để trong túi mà không biết nó rung gửi từ google pixel 4 xl bằng vozfapp,neg
"đúng là nó khá giật thật, nhưng với mức giá thế thì nó vả bọn tầm trung hiện nay phát một ak còn 1 điều nữa, con 3xl nóng phết, cái này chắc do con chip 845. chứ 855 trên 4xl thì lại ngon, mát",neg
"mình mới hỏng màn con pixel xl, qua dùng con lg v40 trên android 9 mà cảm thấy bức bối vcl",neg
bên taobao bán con này chưa kể tiền ship về đây là 5700 mà bên kenta9x này bán 5500,pos
mấy con này ko bán chính hãng ở việt nam nên cũng rén vl khi mua,neg
"đây bác, định đặt luôn mà xem mấy cái đặt cọc với nạp tiền loằng ngằng quá thôi để sáng mai tính",neg
"android 12 như cái đb ấy các bác, uống pin như hút máu",neg
"con 4xl độ bền như nào vậy mấy bác, em cứ nghe trên mấy nhóm pixel bào bỏ túi cấn với rơi dễ hư màn",neg
nhưng mà hàng taobao mua online ko được xem tận nơi cũng rén bác ạ,neg
"nhầm tí, 4xl shop bán 7 triệu nhưng mình nghĩ vẫn ok trong tầm giá",pos
"cũng ham mà cái tai thỏ to thù lù, đã thế lại không 5g, ngó sang con 4a khéo thấy hợp hơn",neg
"à video với chụp ảnh xử lý hơi chậm vì chip có snap 670 thôi, cái này mình chấp nhận dc",pos
"máy thì ko lỗi phần cứng,nhưng có vấn đề với cục pin độ nói chung là back 100 là ngon rồi,mình cũng mua máy của 1 thương gia khá uy tín,tìm ra lỗi phần cứng nhưng back lại vẫn bị trừ 200k",pos
"mùa dịch mấy anh ship giá mắc hơn bình thường một chút tôi ko nói, vấn đề là hàng điện tử đi lâu vkl với hên xui nữa",neg
4xl lock full chức năng như quốc tế 6450k,pos
"nó đang là shop bán pixel chạy nhất taoboa đó , em nghĩ nó gửi mẹ con loại 2 cho em chứ k phải tiêu chuẩn chính thức , hàng ép kính",neg
"nhìn vỏ nguyên cục, không thấy rãnh cắt đâu, mình đoán 99 là nhựa rồi thím, nhôm thì quá vô lý. gì mà lâu vậy thím, pixel 4 giờ giá tầm 10 triệu chứ mấy.",pos
em lại cho nó về bên tq rồi bên giaonhanuytin nhận xịn thực sự,pos
mình vừa oder taobao con này về đến việt nam 8300k,pos
"3g giờ còn người dùng à 3g thì chịu ám màn là mua về bật lên bị sẵn do vớ phải máy lỗi, hoặc xui hơn thì đang dùng thì bị tỷ lệ này chưa thấy mấy, trong gr pixel chưa thấy ông nào khóc về việc này",neg
"mới ra thì mắc. chưa có cơ hội trải nghiệm, kiếm con pixel lấy gg photo free cũng ổn gửi từ huawei ele l29 bằng vozfapp",pos
đm google phát lên android 11 gg pay toạch luôn,neg
"em đang xài con px3, công nhận phê thật, trừ khoản pin mấy bác cho em hỏi có độ pin con này được k, e ở sg",pos
máy không phải thị trường us uk thì check không ra bảo hành,neg
"e mới mua con pixel 2 làm máy phụ , nhà có mấy cục sạc quick charge 18w , cục 15 w của samsung còn shop thì nó tặng cục 10 w mình nên dùng cục nào nhỉ",pos
"có nên đổi 4xl sang con redmi k40 pro gcam không các thím. con 4xl thấy màn tối không sướng mắt lắm, được mỗi camera ngon thôi , mà giá con k40 pro cũ giờ tầm 8m8",pos
"hàng tuồn toàn thương gia vn bán mà bác chả ảnh hưởng gì đâu, giá pixel 3a 3axl 3 3xl 4a 4 4xl vẫn cao chót vót",neg
thấy hình thức cũng ok đó chứ bạn. rẻ hơn kha khas so vs các thương gia đang bán ở vn r,pos
đang order con pixel 3. đọc thớt này sớm là đỡ mất tiền mua con mì xào rồi.,pos
"dùng con 3a với 3axl mất mẹ cảm tình lưu ảnh lâu, lại méo có ai chụp ảnh đâu",neg
có vân tay và mấy loại cổ điển khác bác ơi. mình chưa được xài 4. mới tới 3xl thôi. 3xl thì màng hình màu đẹp mắt và rõ. màu sắc hơn hẳn con pixel 2. nên trông đợi là 4 và 4a màu cũng phải tương đương.,pos
"hổm mua con 3xl này, xài dc vài bữa cho thằng em bật max 100 độ sáng mới chịu dc, màn hình tối ko sáng bằng oneplus 7t đang xài sạc lâu, 18w lâu vkl cam 1 cái ko có góc rộng chụp chán tiễn vong",neg
vẫn unlimited nhé chỉ là chất lượng ở mức hight quality thôi duy chỉ pixel 1 vẫn hỗ trợ original quality nhé,pos
tầm giá 3m5 chắc 3xl ngon nhất rồi nhỉ.. sent from realme rmx2121 using vozfapp,pos
"màn con 3 xl đc đánh giá đẹp nhất trong các dòng pixel đấy. chụp người camera chính là chủ yếu thì 3 xl thua 4 xl ko nhiều đâu, kiểu một 9 một 10 ấy thậm chí là một 9,5 một 10 . nếu ko zoom lên soi kỹ thì ko thể nhận ra đc sự khác biệt. nhiều app ko mở bằng face unlock đc, nói chung là dùng nhiều những app dạng như app ngân hàng thì bất tiện đấy.",pos
"pixel 3 hay 4 đây fen, nhìn nước ảnh thích quá",pos
