comment,label
"k trâu bò, nhưng nhìn chung cũng ổn chứ k kém bền so với mặt bằng chung.",pos
"3xl dùng ngon, trước mình sài 1 tháng ưng dã man, tiếc là giờ ram 4gb cảm thấy cứ soắn soắn",pos
giá cao vl e mua con pixel 4 có 5 triệu 7 mà ổng bán 8 triệu sent from google pixel 4 via nextvoz,neg
"lock thì mỗi lần reset máy xong phải cắm vào máy tính chạy lệnh adb khá đơn giản, xong là như quốc tế, thay sim hoặc add esim ầm ầm nói chung mình thấy px lock phê hơn iphone lock",pos
"điên à mà mua khác gì mua iphone ko có faceid, mất mẹ 1 3 giá trị cái máy",neg
chính xác là chụp người và xóa phông đẹp thôi. chụp cảnh thua xa huawei...,pos
"mình thấy oke, nếu yếu cũng chỉ yếu hơn không đáng kể vì mình ở trong phòng, cách nguồn phát wifi tầm gần chục mét và 3 lớp tường vẫn bắt oke. với mình như vậy là ổn gửi từ google pixel 3 xl bằng vozfapp",pos
ở vn có bác nào nhận order 4a chưa ta page pixelvietnam thấy báo giá nhưng nhắn tin hỏi thì không trả lời,neg
4xl thương gia giờ bán 6.5 triệu thì cũng khá p p trong phân khúc đó chứ,pos
"2 con khác nhau về hệ điều hành, tùy nhu cầu fen nhé về sử dụng thì dòng 3a lag lắm, 7 plus vẫn mượt, kèo này mình vote 7 plus",neg
"bị thuốc mua con 3xl ở đây, hên cái vẫn dùng ngon nên cũng không có ác cảm gì, giá thì cao hẳn nhưng hàng họ ngon, nhận máy pin vẫn còn tốt, check choác oke hết, áp zin, cho đi bơi ầm ầm",neg
pixel 5 giá ở vn toàn tận 20 triệu .,neg
"loa thì chắc chắn hơn đứt mi 8. mic thì e ko biết, nhưng con 3xl mic thu hơi tệ, ko tịt tịt như tụi xiaomi mà nó lẫn tạp âm nhiều. nghe nói có mỗi đời 3 bị thì phải, chắc 4 ngon hơn. rung thì ngon như bên iphone. rung tê cả tay luôn. nên mua bác nhé. sent from google pixel 3 xl using vozfapp",pos
"pixel 4xl, đầm tay, pin khá, mỗi tội thời buổi covid nên cái 3d face unlock không tiện dụng mấy.",pos
"con 4a giờ giá vẫn cao quá, bằng mịa cận cao cấp rồi",neg
"tôi dùng android 11 beta vẫn k , netflix, grab, thanh toán ngân hàng bình thường mà. chỉ khi nào root mới ảnh hưởng thôi.",pos
"con 5a ra mà con 4a5g hoặc 5 giảm còn 8 triệu là em xúc, đổi con 4xl đang dùng. em thích nhỏ gọn mà pin trâu méo gì con 4a 5g tận hơn 9 triệu, 5 tận 12 triệu",neg
có ông kia bán 3xl 3.7 triệu hàng 98 via thenextvoz for iphone,pos
"re đó, mình mua hết hơn 8 triệu",pos
"mình cũng thấy con 4 xl hơn 3 xl ở cái màn 90hz mượt mà hơn thôi, còn mọi thứ như đánh giá của thím này cái ram 6gb vs 4gb nữa",pos
"bọn gg kiểu lấy người dùng ra test ý tưởng hay sao ấy, cái dark mode đang ngon nghẻ thì nó làm lại, thiết kế pixel 4 với 5 đang thấy ổn ổn thì cho ngày quả 6 tin đồn nhìn mù cả mắt",neg
"sắp về rồi đó thím, nhớ review nhé để em quất 1 con, éo hiểu sao có bản 32gb",pos
review thấy cũng có tỷ lệ máy lỗi phải đổi,neg
3xl dùng ổn à bác trước cầm mấy hôm tiếc vì màn đẹp. xem netflix công nhận cũng thích. nhưng pin yếu quá 3,pos
"có máy đẹp đó fen,nhưng bị thay pin rồi",pos
"pixel 5 mà tầm giá 12 triệu có ổn k mấy thím , bên nhật giá ngon quá ạ cam thì nghe nói cài cam mod sẽ tắt âm dc nên k lo lắm",pos
liên hệ shop trả hàng hoàn tiền thôi thím. chỉ hơn kém nhau 32gb bộ nhớ trong mà giá từ 4.2 2.8 là có vấn đề rồi,neg
"nghe gọi to rõ, rung hơi yếu so với iphone , loa thì ngon 3, 3xl gửi từ google pixel 3 xl bằng vozfapp",pos
máy pixel thấy chờ hạ nhiệt chắc cũng phải 2 năm sau,pos
chưa biết xuất sắc đến đâu nhưng riêng cái android gốc của bọn này dùng chán kinh,neg
"thua , con 3xl không 2 sim được. con 4xl thì không faceid ko nói , ko vân tay hơi bất tiện.",neg
"ko, tùy thuộc vào mục đích, lợi thế của pixel là ảnh cùng độ mượt, ngoài ra các điểm khác đám tàu ăn đứt.",pos
"chuẩn fen, gì đâu mà con pixel 3 có nơi bán 4m4, có nơi bán 6m, có nơi 5m6 cho hàng 98 99",neg
"vẫn được gọi là đẹp so với mấy con kia, chắc chắn là như vậy. nhưng lại không đa dụng bằng vì chỉ có 1 ống kính. nếu chỉ để chụp ảnh nghịch thì rất ổn",pos
lát đi làm con 3xl 128gb bên quang vinh đoàn giá phủ lý,pos
"bây giờ mua con 4a ko nên, giá khuyến mãi bên đó có 300 usd thôi, về hét giá quá đắt",neg
pin hơi yếu dùng nhiều không đủ một ngày. nhiều features và cam đẹp vậy thoai. 2 sim thì nó hên xui tùy con có con để chạy 2 sim 2 sóng mệt vkl sent from nokia cục gạch using vozfapp,pos
sao em chọn kiểu gì mà pixel 3 xl có hơn 4 triệu nhỉ package a luông,pos
này mua bên tàu chứ đâu phải đt tàu mà rén bảo mật gì thím mua online chỉ là ko coi được hàng thôi,neg
"nhi n gia pixel giơ đe p qua zơ i, tu t nhanh kinh, xem qua thâ y ae ba n 4xl toa n 7 triệu 8 triệu ma ma y đe p",pos
"thời gian chờ trên pixel quá kém các thím ạ ,ngược lại tối ưu hóa khi sử dụng ứng dụng ít hao pin thì ok . game và video call thì thôi chả buồn nói nóng như lò than",neg
pixel ngon nhưng pin yếu sinh lý quá mấy fen. đang nghía con pixel 5,pos
thấy bảo là máy không phải thị trường us uk thì ko tra được,neg
500k cục pin mới xài 1 2 năm thì có đắt đâu. thay để dt phục vụ cho mình nữa chứ,pos
thế thì mua 4a của gian thương ngon hơn nhiều,pos
hic mấy con này giờ giá rớt nhanh quá gửi từ google pixel 3a bằng vozfapp,pos
"em có ông anh có cty, nên ship về kho bên tq là chuyển về vn cho em ngay",pos
"mới lấy con 4a, mà cái thanh google search ngứa mắt quá, giờ launcher nào ngon nhẹ chạy được với android 11 anh em nhỉ gửi từ oneplus 7t bằng vozfapp",neg
"3d face unlock của android nó không ngon như iphone đâu lắm lần mở màn hình lên chả tự quét, có lúc đeo khẩu trang thì mở đc, lúc lại không.",neg
"vừa hốt con 4a 5g sau khi ra store test cả 2 con 4a5g và 5, có điều máy bản jp ko tắt tiếng cam được",neg
"em chuyên mua hàng loại 1. 2 con đầu đủ sạc cáp, dán sẵn cl, ko ốp cá biệt con pixel 4 full giáp, full hộp, tặng kèm tai nghe bluetooth loại rẻ tiền",pos
ảnh lộ con px5 thím,pos
thèm con 4a quá mà hỏi thì ship về mất 2 3 tuần,pos
mua điện thoại tàu ơi réc khoản bảo mật mà giá hấp dẫn quá,pos
thím nào có link gcam bản mới nhất ko cho mình xin về cài chứ app mặc định nó cứ kêu tách tách mà bản jp ko tắt được,neg
vâng mới 100 phụ kiện đầy đủ,pos
bảo hành gì nữa order taobao xác định vứt mẹ cái bảo hành đi,neg
"ui, e dùng nhiều telegram với viber và skype nó đơ lắm, chắc do con pixel 3 triệua e nó cổ rồi. chờ pixel 5 nó giảm e cũng làm 1 con thay thế.",neg
"3axl vừa rẻ vừa trâu bác, bác có đk thì lên pixel 5 sent from google pixel 3a xl using vozfapp",pos
4 a 7 tr,pos
"mình cũng xài pixel 3 đây, so sánh với con htc u11 thì con pixel 3 ngu si toàn tập, ăn mỗi chụp hình chứ ngoài ra mọi thứ thua hết từ pin, màn, loa, quay video, mic thu âm, mic thoại, nhiệt độ khi sử dụng điện thoại google pixel 3 đều dở như hạch.",pos
"giá rẻ mà máy ngon đó bro , hôm nào rảnh phát chạy qua lựa mới được . cứ đợi lô hàng mới về rồi qua lựa là ok",pos
giá thế là cao mà nhỉ,neg
3xl mà 4 triệu thì hơi rẻ quá đó ạ. không biết là đã can thiệp gì chưa. thực ra nếu mà thay màn cũng chả sao cơ. vì màn bọn này chắc chả có lô. với lại pixel có thay thế sửa chữa cũng k sao cơ. vì những thằng thợ làm pixel chẳng có thằng nào lởm,pos
"em vừa order gian thương ship bên tàu về, được cái họ check hàng kỹ rồi mới giao cho mình, tự ship rủi ro lắm, mua về nghịch nên cũng không gấp",pos
"unlock cũng đơn giản thôi mà, 1 nốt nhạc",pos
"mình mới liên hệ bên giaonhanuytin , vận chuyển nhanh thì tầm 2 ngày là trên tay. nếu ở hn",pos
ngon vãi. mình thích mấy con 0044. 3xl thương gia vn bán toàn 6.2 triệu 6.7 triệu. thợ cỏ thì 5.5 triệu. nguồn hàng thì cũng từ đây mà ra cả. nhẽ xúc bừa phát.,pos
"pixel thấy có đợt về lô 3a new lock, mà unlock cũng dễ có hơn 3 triệu hay phết nhỉ, tiếc mỗi emmc, ko phải ufs, chứ ko mua 1 cái nghịch",pos
"mua trúng hàng lô hả fen con 3xl của thằng bạn thấy sáng ok mà, ra nắng thì ko quá sáng nhưng cũng tạm đủ nhìn mà. còn sạc thì như bao cục 18w khác thôi, gần 2h full",pos
"ở vn thì gửi usps qua hải quan rồi về bưu điện, tầm 3 tuần. package dưới 500g tầm 35 chum qua trung gian thì ít nhất hai tuần trở lên hên xui, tầm 25 chum tổng thiệt hại là tối đa là 495 50 chum ở mẽo thì mình gửi chuyển phát liên bang tầm 4 ngày là tận tay, tầm 10 đô, thiệt hại 500 chum",pos
"uh chủ yếu là mua hàng bên đó rủi ro cao, có việc gì thì rách việc thôi",neg
"đợt này đang dùng mì xào mà quay về nhìn giá mấy con 3 3xl thấy ngứa tay quá con 3xl dùng sướng vl mà có 2 triệu, ghét mỗi cái 1 sim. pixel 4 giá 4 triệu thì cũng êm đấy nhưng tính ra chả hơn mấy, mà giá gấp 2",pos
đang đặt 32 gb đây đang dùng 1 máy rồi con 3a cũng để nghe gọi chụp vớ vẩn thôi chả quan trọng lắm hàng đang tq vn rồi mong có trước sinh nhật,pos
"p3 nóng hơn nè, màn xấu hơn nè, nhỏ hơn nè, thiết kế cũng k có kính 3d như u11 nè. loa nghe dở hơn nè, thu âm tệ hơn nè, pin cũng cùi hơn nè nhiêu đó đủ chưa",neg
chịu đc pin yếu thì ok.,pos
"rung dc, ko yếu, mỗi tội auto độ sáng ko nuột lắm, chắc vấn đề chung của nhưng con full màn, cảm biến nó khó như những con màn viền dày như xưa sent from google pixel 5 using vozfapp",pos
tìm hiểu lại thì boss gg photos nói px 2 5 vẫn unlimited nhưng chỉ dc hq. vụ xl đời 1 mình đọc đâu đó éo nhớ cũng tìm éo thấy nên chắc fail,pos
quất lại cho anh em thấy,pos
công nhận là cũng rẻ. tự nhiên thấy giá xperia 1 mất vân tay pixel 4 cũng phân vân ghê.. sent from oneplus gm1915 using vozfapp,pos
mua shopee có hơn 3 triệu fullbox con 3a xl thôi,pos
"bác có dùng zalopay ko check hộ e với, cứ mở app lên là crash app ngay, ko vào nổi sent from google pixel via nextvoz",neg
"e thấy trên group fb đăng vậy hình như bonmobile gì đó, 3xl mới 3.7 triệu",pos
mấy con đầu 3 thấy nhiều người bảo bị loạn cảm ứng khi up 11 via thenextvoz for iphone,neg
"pixel giờ phổ biến rồi, đầy thợ sửa",pos
ko có cảm biến quang phổ với chip xử lý pixel visual core đâu thím,neg
vừa thấy giá xong giá này mấy bố kia khóc thét. đợi pixel 4 xuống 4m5 4m8 hoyyy. sent from realme rmx2121 using vozfapp,neg
"công nhận, sạc xong chả làm gì, hơn chục phút đã thấy hụt xuống 99 rồi, rồi cứ rớt dần rớt dần 98 97 . nhưng nếu xài liên tục thì thời gian onscreen tạm ổn.",neg
mới lấy con 3axl mà cái màn nó xấu hơn cả con live 1,neg
"máy em lỗi trả bảo hành bên vận chuyển , giao cho bọn bán rồi đợi hàng về thôi",pos
tui thấy tụi taobao vẫn bán pixel với pixel xl kìa . giá cao,neg
đồ google thì dc cái trâu nhưng xấu,neg
hình như pixel 3 hay 4 gì cũng ko hỗ trợ xuất video qua cổng type c đúng ko các bác.,neg
"đợt vừa rồi em mua con 4a ở anhemmobile. thấy khá là ok, shop nhìn hơi bé tí.",pos
mới dùng con pixel 4xl dc nửa tháng. cảm nhận vẫn thích con nokia 8 cũ hơn đã ra đi màn hình do rơi trên bàn xuống nên mới mua 4xl .,neg
"cầm con oneplus đi thấy 3xl màn nó tối, dù đẹp nhưng tối ko đã xài 2h là lâu, con oneplus 7t sạc 30w chưa tới 1 tiếng",neg
khoái mấy con pixel này up ảnh google photos thoải mái,pos
con pixel 3xl của mình,pos
"móa ơi, cục pin 1 4 giá trị máy",neg
"phí ship 2 chiều giá máy cũ mua có bảo hành tại vn, haha. chưa kể nhận máy xong nó éo gửi lại bác thì bác làm thế nào, hoặc gửi thêm 1 con máy lỗi khác nữa thì khóc tiếng hán",neg
"được 9 10, nhược điểm duy nhất là không share media cho app clone linh hoạt đc như app gốc thôi. còn lại thì hoàn hảo.",pos
vote bảo long nhá fen. uy tín giá rẻ thợ cứng pixel dễ sửa chữa tôi mua 3xl dùng sắp đc 1 năm rồi thấy ngon đét sent from google pixel via nextvoz,pos
vậy tích vốn để cuối năm rước em.,pos
"thế là bác lại bị hớ rồi, giờ người ta lên 4xl chứ mua 3 vào thì mấy hôm rồi lại đổi gió",neg
"4xl bản no face ở vn có thương gia bán 9 triệu thôi thím, mua ở vn cho yên tâm",pos
"loa thoại con 5 sao thím thấy bọn youtuber nó chê. ưng con 5 này nhất trong các đời pixel, mà bọn gg lần méo nào cũng làm cái đth có điểm yếu gì đó, shit.",neg
tôi cũng thích nhưng đợi về 3 triệu thì phải 1 năm nữa,neg
"giá ngon vậy , mà hình như ông này mới bán bản pixel 4 nay lên lại 4xl à",pos
"nãy check mới thấy, thế thì thành ra lại dùng pin như thời hán pixel 5 lại về với vân tay.",neg
"các fen thấy thương gia kenta9x này bán hàng ổn không chứ mình hỏi thấy bán con pixel 4 99 còn cam kết zin keeng, nguyên áp mà bán có 5500 rẻ hơn cả bên taobao",pos
"bl, aemobile, cường hp là top 3 giá cao ở miền bắc rồi",neg
khen 3xl là khen cái giá bằng 50 con 4xl thôi chứ nó thua 1 đời hiệu năng thua rõ là đương nhiên roài,pos
"gian thương bán 11 triệu cách đây cả tháng rồi cá nhân mình nghĩ 8 triệu ok, trên nữa ko đáng",neg
dùng kiểu hơi khổ dâm ấy cái gì cũng ko có haha,neg
pác cho hỏi thấy nó ghi o m là gì vậy pác. thấy 3xl 64gb 1 gạch nó để giá 760 tính ra về cỡ 3.1 triệu 3.2 triệu. mà thương gia vn bán tới 3.8 triệu 4 triệu via thenextvoz for iphone,pos
"con pixel 3a xl mới mua dc mấy tháng mà tự nhiên màn đen thui, báo thợ bảo đứt cáp màn hình giờ thay hết 2 triệu, bằng nửa tiền con máy, có nên thay ko mấy thím",neg
"zalo pay máy mình dùng hoàn toàn bình thường. chắc máy b thuộc dạng tester, chuột bạch cho google rồi, báo cáo lỗi đi",pos
4xl giờ 6 6.5 triệu . trước tính mua giờ bỏ mua con khác via thenextvoz for iphone,pos
vừa múc con 4 xl dùng phê vãi cức,pos
"cho xin cái địa chỉ luôn b ơi tôi ngó sơ sơ toàn 3.7 3.8, nói mà không dịch ship tàu về rẻ hẳn 1 3 cũng đáng chớ",neg
"kì, ta con 5 em thấy rung mạnh lawmz ủa motor rung mau yếu lắm hả thím gửi từ google pixel 5 bằng vozfapp",pos
"đúng rồi, nó đục đục, khi chạm vào 1 thành phần trong hệ thống nó còn có kiểu chấm chấm nhìn chán lắm. chưa kể để light mode nhưng notification centre với control centre nó lại đen, bts bọn google.",neg
"đương nhiên là màu chuẩn hơn đám huawei rồi, hw lên màu chán",pos
mới thấy kèo pixel 4 xl new fullbox unlocked 450. thơm bơ thế thì vứt con 4a được rồi,pos
bỏ đi. chip cũ quá rồi,neg
"theo mình nghĩ pixel mua ở thị trường nào phải check imei ở đúng google store với tên miền của thị trường đó. imei 35 thì chọn region us, 99 thì những nước khu vực châu âu. như con 3xl mình thử với gb thì 1 phát ăn ngay",pos
"màn bình thường tối nhưng lúc bật youtube nó sáng hơn nhiều, nay bật thử 4k hdr youtube 3a xl mà nó đẩy sáng hơn cả con amoled redmi note 10 pro màn thế hệ mới.",pos
"vậy lấy 3axl cũ thôi. pin trâu, trải nghiệm mượt. chụp ảnh okie. lưu ảnh hơi chậm tý thôi. em khoái vụ cam trước nên lấy px3. pin sạc ngày 2 lần cũng đc.",pos
vào hội pixel là ra bác ạ. quang vinh doan. mà em cũng chuẩn bị say goodbye với pixel 3. nhiều máy quá hôm qua vừa cho con oneplus 7 pro về android 10. chắc là dùng tốt hơn thật. chắc cũng bay luôn con 7t.,neg
"lâu ko update giá , giờ giá ổn ghê mình thích 4a5g , chắc đợi sang nam",pos
mình thấy giá vẫn 350 đô mỹ mà nhĩ,pos
"trước đây em cũng máu con u11 nên vào mấy group fb hóng suốt. về âm thanh. thu âm pixel 3 thua, chứ chưa thấy ai khen pin u11. dưới đây là ví dụ, pin u11 sụt còn hơn s8 trong khi pixel 3 ăn được s8 hay kể cả s9",neg
con pixel 2 triệua em chạy andr 10 vẫn ổn. thay cục pin vô onscreen 5 tiếng ngon ghê,pos
"em có con pixel 2 mà nó bị vọng lại tiếng của người mà mình gọi hoặc nguời ta gọi mình, ng ta nghe bị khó chịu lắm, không biết lỗi này là sao , xin nhờ anh em chỉ dùm hoặc tìm chỗ sửa ạ . xin cảm ơn anh em mình ở tphcm",neg
"eu có thể unlock, root, ko nghịch thì éo để làm gì 3xl chắc chắn 2 sim 1 sóng nhé thím có android 10 beta cho 2s2s nhưng ai dùng bản beta cũ rích",pos
"được mỗi cái pin, dùng chán lắm chắc em cũng sớm cho nó ra đi ....",neg
"con 4a dùng ok k mọi người, thích 4a5g mà giá vẫn còn căng quá, 4xl thì pin hơi hẻo do mình dùng đt nhiều nên yc pin trâu tí",neg
3.5 triệu fen ơi,pos
"3xl mua của người dùng tầm 5.2. còn nếu mua của shop, có bh thì 6.0 là con số hợp lý, nên mua con đó",pos
của mình không hiện giống bác nhưng hiện là số imei không tồn tại luôn. nhiều khả năng giống như bác trên nói là hàng tuồn rồi.,neg
up nhẹ team pixel,pos
"con nào giờ màn sáng nhất nhà pixel nhỉ, dùng 3xl màn tối vãi, ức chế . biết bao giờ 5 mới rẻ như 4 hay 4xl, nhỏ gọn gửi từ v0z bằng vozfapp",neg
mình chưa gặp vấn đề gì với loa thoại cả. nhiều khi còn phải cho nhỏ lại thì to quá,pos
"bác nào tính mua pixel 4 xl thì nên cân nhắc khoảng pin nhé. ko trụ nổi 1 ngày làm việc 8 tiếng onscreen chỉ lướt web thôi. điểm nữa là ko có thẻ nhớ mở rộng, tuy nhiên dc cái goole hỗ trợ dung lượng google one. nếu cho mình quay lại cách đây 2 tháng thì mình sẽ chọn con khác. ahihi",neg
3 con em mua cùng loại đó đố tìm được vết xước nào luôn,pos
bản o mở được bootloader để up rom tuỳ thích. bản m thì không mở được,pos
4xl no face id,neg
"gần 8 triệu thì phải full sáng 90hz không sao có điều sáng em gắn sim vô test, sim em sim 3g cứ được tý là mất sóng không dùng data được thôi để chụp ảnh cũng được không biết phải do android 11 không",pos
thơm đấy nhưng lâu quá lười lắm em quất taobao đây,pos
"mình đang dùng 3a xl. làm sao để xoá đc mấy cái ứng dụng của google nhỉ, như chrome, youtube...toàn mấy cái cài ở ch play",neg
tính ra tiền ship 3 lần cũng 6 700k nhỉ,neg
"là hàng lock mỹ bản verizon, đã kích hoạt bảo hành, mới, ổn áp, mình cũng đang xài 1 con. đang tính bán lên đời",pos
"đang dùng 4 đây fen, máy mát nhé giá user đang tầm 5 đồng 5 là đẹp",pos
mua ở đâu uy tín mấy pác... bên mobileworld có 6750 mà ở xa ko test dc. via thenextvoz for iphone,pos
"con 3xl 128g mua đâu được giá tốt nhất nhỉ, thấy giá ở hà nội còn đắt toàn trên 6 triệu gửi từ v0z bằng vozfapp",neg
không. pin yếu màn toàn ám. nên mua pixel 3 vì giá đã trở nên rất rẻ. rẻ đến nỗi là pixel 2 chênh pixel 3 vài lít.,pos
"mềnh vừa join grp fb hôm qua. vào grp thì thấy đa số gian thương chê hàng taobao là hàng dựng. quả thật cầm 7 triệu đi mua taobao nó cũng rủi ro thật, nhưng các gian thương bán hàng mắc vcl. chả biết hàng căc lão ấy mua ở đâu hay cũng hàng taobao ra .",neg
"faceid mở khoá ngon ko kém iphone, đỉnh luôn",pos
thốn thật đợt tháng 9 máu dồn lên não tí mua con 3xl trên đây. thím gửi link shop cho ae biết đường né nào,neg
3 triệu mua đc 3xl user hoặc 3 shop,pos
"mới mua con pixel 3 , pin hơi tèo mà máy phụ nên dùng cũng ít chủ yếu chụp đêm, với xem map via thenextvoz for iphone",pos
với tác vụ bình thường có khựng lag gì không thím. trên youtube thấy bảo lúc chuyển đa nhiệm không được mượt cho lắm vì chip cùi,neg
"con vivo x60pro chụp đẹp vcl luôn thím, nếu vậy pixel 6 hẳn là cuộc cách mạng rồi giá tụt vcl luôn thím ơi. loay hoay cái rớt nhanh hơn samesung tụt quần. giờ đổi dòng máy khác cũng lỗ vài cũ nhẹ. mấy con ngang ngang thì không cần thiết đổi . còn flagship thì phải bù ít cũng 7 8 triệu là ít nhất",pos
e làm con tiêu chuẩn chính thức giá cũng khác thật tận 3m2 đợi hàng về review với các bác xem sao,neg
"px 5 cũng ổn mà thím, có mỗi chip k phải đầu bảng thôi. mà mình thì k chơi game, nên thấy con 765g không vấn đề gì, chờ coi hạ nhiệt rồi mua một em. thích kiểu màn đục lỗ mà lệch một bên, chứ đục ở giữa thấy gớm gớm, như mấy mẹ ấn đụ dán cái cục giữa trán ấy",pos
"mình mới mua con pixel xl cũ giá 1.5 triệu , gcam chế độ chụp đêm xài rất tốt up free lên photo k kết nối đc vs pc bằng cáp nên khó chuyển dữ liệu không có sd card",pos
"dòng pixel độ sáng thấp, con nào cũng vậy nên thế là bình thường bác ạ.",neg
"test áp suất hơi yếu chống nước kém. còn lại ngon vl nhé, ko lỗi lầm gì, pin trâu. hôm trước em bán được giá 5.8 sau khi dùng 5 tháng. giá bình quân ở vn hiện tại chắc 5.5. nhắc lại là máy có 1 sim thôi đấy. dual sim single standby",pos
google camera có bản mod cam từ mấy năm nay rồi mà,pos
"bác nào lên android 11 pin tụt hơn android 10 không con px2 triệua em bản 10 onscreen được gần 5h, lên 11 giảm còn 3h30 4h thôi.",neg
thực sự nể những fen có tiền mua pixel 4 4xl 5 tôi sài con 4 thấy ko xứng đáng với giá xèng chút nào,neg
"mua rồi nè các thím, pin tụt như tụt quần. màn hình đẹp miễn chê, chụp ảnh đẹp. onscreen chắc cỡ 3 tiếng, tại mua máy cũ sạc 1 tiếng rưỡi. ko biết do củ sạc hay do máy nó vậy. với con 845 có vẻ hơi nóng. chạy bình thường, lướt voz là nó ấm ấm rồi. game e chưa chơi nên ko biết. gửi từ google pixel 3 xl bằng vozfapp",pos
ngó giá nên đây mắc vãi nồi. có ông kia bán 3.7 triệu kìa. dư 300k làm cap sạc via thenextvoz for iphone,neg
"thế là thêm phí 150k rồi. thôi kệ, tranh thủ kêu họ check dùm hàng khi nhận đi, do nếu bị lỗi thì ko ship ngược lại dc",neg
"tất tật mà có 40k á thím, rẻ vậy mà nếu sạc nhanh thì nó hiện charging rapidly nhé",pos
e vừa cập nhật os đêm qua 320mb mà cũng 3xl sent from google pixel via nextvoz,pos
mình có cả 3a xl và 6s plus thấy mượt như nhau bạn à. 3a xl thì sạc nhanh và pin trâu hơn,pos
"nhìn mấy con px cái 2 cái viền trên dưới nhìn tức mắt thật, được cái rom thuần nên mượt, trước em dùng 3xl h lại quay lại lg",pos
sếp này đang bán pixel 4 đã độ pin 6 triệu. nằm suy nghĩ mấy đêm vẫn chưa thông,pos
"nhín vỏ nguyên khối thế kia chắc là nhựa rồi. nhưng đc cái mặt trước cằm mỏng, đẹp. pin chắc là trâu. chờ nó hạ nhiệt rồi mua làm máy phụ",pos
"cảm ơn bác đã chỉ cách, mình ghi âm thì không bị, chỉ khi thoại mới bị thôi á",pos
khẩn cấp bác nào dùng google pixel 3xl có thể cho em feedback có phải là màn độ sáng thấp không để 50 khá tối luôn ý ạ. để 70 trở lên mới được. 100 thì sáng hẳn rồi.,neg
"shop bán tầm trên dưới 2 triệu, mua lại của người dùng tầm 1 triệu đổ lên tùy tình trạng.",pos
"máy mình không bị, dùng cả 2 app zalo đều không vấn đề gì luôn. đã test trên cả android 11 lẫn 12 dp3",pos
"mình có con 3a xl lúc chuyển qua lại youtube, game, chrome và các app khác không thấy lag gì nha thím.",pos
